{
  "schemaVersion": 1,
  "id": "lean_listen_c2",
  "rigProfile": "lafei_8.front.v1",
  "durationSec": 1.6,
  "channels": [
    "torso",
    "head"
  ],
  "phases": {
    "prepareEnd": 0.45,
    "strokeEnd": 1.2,
    "recoverEnd": 1.6
  },
  "curves": [
    {
      "role": "body.root",
      "property": "rotate",
      "mode": "relativeToReference",
      "keys": [
        {
          "t": 0,
          "value": 0,
          "ease": "bezier",
          "bezierCP": [
            0.3,
            0,
            0.4,
            1
          ]
        },
        {
          "t": 0.45,
          "value": 12,
          "ease": "linear"
        },
        {
          "t": 1.2,
          "value": 12,
          "ease": "stepped"
        },
        {
          "t": 1.6,
          "value": 0,
          "ease": "bezier",
          "bezierCP": [
            0.5,
            0,
            0.7,
            1
          ]
        }
      ]
    },
    {
      "role": "body.root",
      "property": "translate",
      "mode": "relativeToReference",
      "keys": [
        {
          "t": 0,
          "value": [
            0,
            0
          ],
          "ease": "bezier",
          "bezierCP": [
            0.3,
            0,
            0.4,
            1
          ]
        },
        {
          "t": 0.45,
          "value": [
            0,
            -0.01
          ],
          "ease": "linear"
        },
        {
          "t": 1.2,
          "value": [
            0,
            -0.01
          ],
          "ease": "stepped"
        },
        {
          "t": 1.6,
          "value": [
            0,
            0
          ],
          "ease": "linear"
        }
      ]
    },
    {
      "role": "head.main",
      "property": "rotate",
      "mode": "relativeToReference",
      "keys": [
        {
          "t": 0,
          "value": 0,
          "ease": "bezier",
          "bezierCP": [
            0.3,
            0,
            0.4,
            1
          ]
        },
        {
          "t": 0.45,
          "value": -6,
          "ease": "linear"
        },
        {
          "t": 1.2,
          "value": -6,
          "ease": "stepped"
        },
        {
          "t": 1.6,
          "value": 0,
          "ease": "linear"
        }
      ]
    }
  ],
  "requirements": {
    "postures": [
      "standing",
      "seated"
    ],
    "views": [
      "front"
    ]
  },
  "provenance": {
    "kind": "llm",
    "model": "GLM-5.3 (dev agent)",
    "promptId": "p1-round3-coordination",
    "candidate": 2,
    "note": "修订2：倾角 7→12°、头反代偿 -3→-6°、重心下沉 0.01H（反馈：与 idle 不可分辨）"
  },
  "approval": "draft"
}