{
  "schemaVersion": 1,
  "id": "nod_head_candidate_mu1y9e8c",
  "rigProfile": "lafei_8.front.v1",
  "durationSec": 0.8,
  "channels": [
    "head"
  ],
  "phases": {
    "prepareEnd": 0.16000000000000003,
    "strokeEnd": 0.5599999999999999,
    "recoverEnd": 0.8
  },
  "curves": [
    {
      "role": "head.main",
      "property": "rotate",
      "mode": "relativeToReference",
      "keys": [
        {
          "t": 0,
          "value": 0,
          "ease": "linear"
        },
        {
          "t": 0.27999999999999997,
          "value": 10,
          "ease": "linear"
        },
        {
          "t": 0.8,
          "value": 0,
          "ease": "linear"
        }
      ]
    }
  ],
  "requirements": {
    "postures": [
      "standing",
      "seated"
    ],
    "views": [
      "front"
    ]
  },
  "provenance": {
    "kind": "builtin",
    "note": "Lab 内置模板，非 LLM 生成"
  },
  "approval": "draft"
}