{
  "schemaVersion": 1,
  "id": "point_right_c2",
  "rigProfile": "lafei_8.front.v1",
  "durationSec": 1.4,
  "channels": [
    "rightArm",
    "head",
    "torso"
  ],
  "phases": {
    "prepareEnd": 0.35,
    "strokeEnd": 0.95,
    "recoverEnd": 1.4
  },
  "curves": [
    {
      "role": "arm.upper.right",
      "property": "rotate",
      "mode": "relativeToReference",
      "keys": [
        {
          "t": 0,
          "value": 0,
          "ease": "bezier",
          "bezierCP": [
            0.25,
            0.1,
            0.25,
            1
          ]
        },
        {
          "t": 0.35,
          "value": 40,
          "ease": "linear"
        },
        {
          "t": 0.95,
          "value": 40,
          "ease": "stepped"
        },
        {
          "t": 1.4,
          "value": 0,
          "ease": "bezier",
          "bezierCP": [
            0.4,
            0,
            0.6,
            1
          ]
        }
      ]
    },
    {
      "role": "arm.right",
      "property": "rotate",
      "mode": "relativeToReference",
      "keys": [
        {
          "t": 0,
          "value": 0,
          "ease": "linear"
        },
        {
          "t": 0.35,
          "value": -6,
          "ease": "linear"
        },
        {
          "t": 0.95,
          "value": -6,
          "ease": "stepped"
        },
        {
          "t": 1.4,
          "value": 0,
          "ease": "linear"
        }
      ]
    },
    {
      "role": "head.main",
      "property": "rotate",
      "mode": "relativeToReference",
      "keys": [
        {
          "t": 0,
          "value": 0,
          "ease": "bezier",
          "bezierCP": [
            0.25,
            0.1,
            0.25,
            1
          ]
        },
        {
          "t": 0.35,
          "value": 5,
          "ease": "linear"
        },
        {
          "t": 0.95,
          "value": 5,
          "ease": "stepped"
        },
        {
          "t": 1.4,
          "value": 0,
          "ease": "linear"
        }
      ]
    },
    {
      "role": "body.root",
      "property": "rotate",
      "mode": "relativeToReference",
      "keys": [
        {
          "t": 0,
          "value": 0,
          "ease": "bezier",
          "bezierCP": [
            0.25,
            0.1,
            0.25,
            1
          ]
        },
        {
          "t": 0.35,
          "value": -2,
          "ease": "linear"
        },
        {
          "t": 0.95,
          "value": -2,
          "ease": "stepped"
        },
        {
          "t": 1.4,
          "value": 0,
          "ease": "linear"
        }
      ]
    }
  ],
  "requirements": {
    "postures": [
      "standing",
      "seated"
    ],
    "views": [
      "front"
    ],
    "resources": [
      "channel:rightArm"
    ]
  },
  "provenance": {
    "kind": "llm",
    "model": "GLM-5.3 (dev agent)",
    "promptId": "p1-round3-coordination",
    "candidate": 2,
    "note": "修订2：新增头部看向(+5°)与躯干反倾(-2°)协调"
  },
  "approval": "draft"
}